[
  {
    "jobId": "7919c9cd-layout-check",
    "seq": 1,
    "occurredAt": "2026-09-30T10:48:04.258973100Z",
    "state": "queued"
  },
  {
    "jobId": "7919c9cd-layout-check",
    "seq": 2,
    "occurredAt": "2026-09-30T10:48:04.265236100Z",
    "state": "downloading"
  },
  {
    "jobId": "7919c9cd-layout-check",
    "seq": 3,
    "occurredAt": "2026-09-30T10:48:05.102816600Z",
    "state": "downloading",
    "completedTiles": 1,
    "totalTiles": 625
  },
  {
    "jobId": "7919c9cd-layout-check",
    "seq": 4,
    "occurredAt": "2026-09-30T10:48:05.949066500Z",
    "state": "downloading",
    "completedTiles": 2,
    "totalTiles": 625
  },
  {
    "jobId": "7919c9cd-layout-check",
    "seq": 5,
    "occurredAt": "2026-09-30T10:48:06.795293300Z",
    "state": "downloading",
    "completedTiles": 3,
    "totalTiles": 625
  },
  {
    "jobId": "7919c9cd-layout-check",
    "seq": 6,
    "occurredAt": "2026-09-30T10:48:07.603260Z",
    "state": "downloading",
    "completedTiles": 4,
    "totalTiles": 625
  },
  {
    "jobId": "7919c9cd-layout-check",
    "seq": 7,
    "occurredAt": "2026-09-30T10:48:08.364187200Z",
    "state": "downloading",
    "completedTiles": 5,
    "totalTiles": 625
  },
  {
    "jobId": "7919c9cd-layout-check",
    "seq": 8,
    "occurredAt": "2026-09-30T10:48:09.137294400Z",
    "state": "downloading",
    "completedTiles": 6,
    "totalTiles": 625
  },
  {
    "jobId": "7919c9cd-layout-check",
    "seq": 9,
    "occurredAt": "2026-09-30T10:48:09.936898400Z",
    "state": "downloading",
    "completedTiles": 7,
    "totalTiles": 625
  },
  {
    "jobId": "7919c9cd-layout-check",
    "seq": 10,
    "occurredAt": "2026-09-30T10:48:10.736478400Z",
    "state": "downloading",
    "completedTiles": 8,
    "totalTiles": 625
  },
  {
    "jobId": "7919c9cd-layout-check",
    "seq": 11,
    "occurredAt": "2026-09-30T10:48:11.521573100Z",
    "state": "downloading",
    "completedTiles": 9,
    "totalTiles": 625
  },
  {
    "jobId": "7919c9cd-layout-check",
    "seq": 12,
    "occurredAt": "2026-09-30T10:48:12.314510500Z",
    "state": "downloading",
    "completedTiles": 10,
    "totalTiles": 625
  },
  {
    "jobId": "7919c9cd-layout-check",
    "seq": 13,
    "occurredAt": "2026-09-30T10:48:17.060632400Z",
    "state": "downloading",
    "completedTiles": 16,
    "totalTiles": 625
  },
  {
    "jobId": "7919c9cd-layout-check",
    "seq": 14,
    "occurredAt": "2026-09-30T10:48:29.816496400Z",
    "state": "downloading",
    "completedTiles": 32,
    "totalTiles": 625
  },
  {
    "jobId": "7919c9cd-layout-check",
    "seq": 15,
    "occurredAt": "2026-09-30T10:48:42.430930400Z",
    "state": "downloading",
    "completedTiles": 48,
    "totalTiles": 625
  },
  {
    "jobId": "7919c9cd-layout-check",
    "seq": 16,
    "occurredAt": "2026-09-30T10:48:55.067734400Z",
    "state": "downloading",
    "completedTiles": 64,
    "totalTiles": 625
  },
  {
    "jobId": "7919c9cd-layout-check",
    "seq": 17,
    "occurredAt": "2026-09-30T10:49:07.675419500Z",
    "state": "downloading",
    "completedTiles": 80,
    "totalTiles": 625
  },
  {
    "jobId": "7919c9cd-layout-check",
    "seq": 18,
    "occurredAt": "2026-09-30T10:49:20.201610500Z",
    "state": "downloading",
    "completedTiles": 96,
    "totalTiles": 625
  },
  {
    "jobId": "7919c9cd-layout-check",
    "seq": 19,
    "occurredAt": "2026-09-30T10:49:32.818026200Z",
    "state": "downloading",
    "completedTiles": 112,
    "totalTiles": 625
  },
  {
    "jobId": "7919c9cd-layout-check",
    "seq": 20,
    "occurredAt": "2026-09-30T10:49:45.380285900Z",
    "state": "downloading",
    "completedTiles": 128,
    "totalTiles": 625
  },
  {
    "jobId": "7919c9cd-layout-check",
    "seq": 21,
    "occurredAt": "2026-09-30T10:49:58.209750600Z",
    "state": "downloading",
    "completedTiles": 144,
    "totalTiles": 625
  },
  {
    "jobId": "7919c9cd-layout-check",
    "seq": 22,
    "occurredAt": "2026-09-30T10:50:10.962263400Z",
    "state": "downloading",
    "completedTiles": 160,
    "totalTiles": 625
  },
  {
    "jobId": "7919c9cd-layout-check",
    "seq": 23,
    "occurredAt": "2026-09-30T10:50:23.837261Z",
    "state": "downloading",
    "completedTiles": 176,
    "totalTiles": 625
  },
  {
    "jobId": "7919c9cd-layout-check",
    "seq": 24,
    "occurredAt": "2026-09-30T10:50:36.476511Z",
    "state": "downloading",
    "completedTiles": 192,
    "totalTiles": 625
  },
  {
    "jobId": "7919c9cd-layout-check",
    "seq": 25,
    "occurredAt": "2026-09-30T10:50:49.453158700Z",
    "state": "downloading",
    "completedTiles": 208,
    "totalTiles": 625
  },
  {
    "jobId": "7919c9cd-layout-check",
    "seq": 26,
    "occurredAt": "2026-09-30T10:51:02.203159700Z",
    "state": "downloading",
    "completedTiles": 224,
    "totalTiles": 625
  },
  {
    "jobId": "7919c9cd-layout-check",
    "seq": 27,
    "occurredAt": "2026-09-30T10:51:14.928038600Z",
    "state": "downloading",
    "completedTiles": 240,
    "totalTiles": 625
  },
  {
    "jobId": "7919c9cd-layout-check",
    "seq": 28,
    "occurredAt": "2026-09-30T10:51:27.780308100Z",
    "state": "downloading",
    "completedTiles": 256,
    "totalTiles": 625
  },
  {
    "jobId": "7919c9cd-layout-check",
    "seq": 29,
    "occurredAt": "2026-09-30T10:51:40.418953100Z",
    "state": "downloading",
    "completedTiles": 272,
    "totalTiles": 625
  },
  {
    "jobId": "7919c9cd-layout-check",
    "seq": 30,
    "occurredAt": "2026-09-30T10:51:53.172487500Z",
    "state": "downloading",
    "completedTiles": 288,
    "totalTiles": 625
  },
  {
    "jobId": "7919c9cd-layout-check",
    "seq": 31,
    "occurredAt": "2026-09-30T10:52:05.783217700Z",
    "state": "downloading",
    "completedTiles": 304,
    "totalTiles": 625
  },
  {
    "jobId": "7919c9cd-layout-check",
    "seq": 32,
    "occurredAt": "2026-09-30T10:52:18.208391900Z",
    "state": "downloading",
    "completedTiles": 320,
    "totalTiles": 625
  },
  {
    "jobId": "7919c9cd-layout-check",
    "seq": 33,
    "occurredAt": "2026-09-30T10:52:30.699306900Z",
    "state": "downloading",
    "completedTiles": 336,
    "totalTiles": 625
  },
  {
    "jobId": "7919c9cd-layout-check",
    "seq": 34,
    "occurredAt": "2026-09-30T10:52:43.357172900Z",
    "state": "downloading",
    "completedTiles": 352,
    "totalTiles": 625
  },
  {
    "jobId": "7919c9cd-layout-check",
    "seq": 35,
    "occurredAt": "2026-09-30T10:52:55.852355700Z",
    "state": "downloading",
    "completedTiles": 368,
    "totalTiles": 625
  },
  {
    "jobId": "7919c9cd-layout-check",
    "seq": 36,
    "occurredAt": "2026-09-30T10:53:08.410612400Z",
    "state": "downloading",
    "completedTiles": 384,
    "totalTiles": 625
  },
  {
    "jobId": "7919c9cd-layout-check",
    "seq": 37,
    "occurredAt": "2026-09-30T10:53:21.149155900Z",
    "state": "downloading",
    "completedTiles": 400,
    "totalTiles": 625
  },
  {
    "jobId": "7919c9cd-layout-check",
    "seq": 38,
    "occurredAt": "2026-09-30T10:53:33.694941700Z",
    "state": "downloading",
    "completedTiles": 416,
    "totalTiles": 625
  },
  {
    "jobId": "7919c9cd-layout-check",
    "seq": 39,
    "occurredAt": "2026-09-30T10:53:46.342552900Z",
    "state": "downloading",
    "completedTiles": 432,
    "totalTiles": 625
  },
  {
    "jobId": "7919c9cd-layout-check",
    "seq": 40,
    "occurredAt": "2026-09-30T10:53:59.025817600Z",
    "state": "downloading",
    "completedTiles": 448,
    "totalTiles": 625
  },
  {
    "jobId": "7919c9cd-layout-check",
    "seq": 41,
    "occurredAt": "2026-09-30T10:54:11.515212700Z",
    "state": "downloading",
    "completedTiles": 464,
    "totalTiles": 625
  },
  {
    "jobId": "7919c9cd-layout-check",
    "seq": 42,
    "occurredAt": "2026-09-30T10:54:24.256702300Z",
    "state": "downloading",
    "completedTiles": 480,
    "totalTiles": 625
  },
  {
    "jobId": "7919c9cd-layout-check",
    "seq": 43,
    "occurredAt": "2026-09-30T10:54:36.868226500Z",
    "state": "downloading",
    "completedTiles": 496,
    "totalTiles": 625
  },
  {
    "jobId": "7919c9cd-layout-check",
    "seq": 44,
    "occurredAt": "2026-09-30T10:54:49.516599100Z",
    "state": "downloading",
    "completedTiles": 512,
    "totalTiles": 625
  },
  {
    "jobId": "7919c9cd-layout-check",
    "seq": 45,
    "occurredAt": "2026-09-30T10:55:02.163158500Z",
    "state": "downloading",
    "completedTiles": 528,
    "totalTiles": 625
  },
  {
    "jobId": "7919c9cd-layout-check",
    "seq": 46,
    "occurredAt": "2026-09-30T10:55:14.644290100Z",
    "state": "downloading",
    "completedTiles": 544,
    "totalTiles": 625
  },
  {
    "jobId": "7919c9cd-layout-check",
    "seq": 47,
    "occurredAt": "2026-09-30T10:55:27.286117200Z",
    "state": "downloading",
    "completedTiles": 560,
    "totalTiles": 625
  },
  {
    "jobId": "7919c9cd-layout-check",
    "seq": 48,
    "occurredAt": "2026-09-30T10:55:39.790173100Z",
    "state": "downloading",
    "completedTiles": 576,
    "totalTiles": 625
  },
  {
    "jobId": "7919c9cd-layout-check",
    "seq": 49,
    "occurredAt": "2026-09-30T10:55:52.478374200Z",
    "state": "downloading",
    "completedTiles": 592,
    "totalTiles": 625
  },
  {
    "jobId": "7919c9cd-layout-check",
    "seq": 50,
    "occurredAt": "2026-09-30T10:56:04.955565300Z",
    "state": "downloading",
    "completedTiles": 608,
    "totalTiles": 625
  },
  {
    "jobId": "7919c9cd-layout-check",
    "seq": 51,
    "occurredAt": "2026-09-30T10:56:17.241480700Z",
    "state": "downloading",
    "completedTiles": 624,
    "totalTiles": 625
  },
  {
    "jobId": "7919c9cd-layout-check",
    "seq": 52,
    "occurredAt": "2026-09-30T10:56:18.017931500Z",
    "state": "downloading",
    "completedTiles": 625,
    "totalTiles": 625
  },
  {
    "jobId": "7919c9cd-layout-check",
    "seq": 53,
    "occurredAt": "2026-09-30T10:56:18.760992600Z",
    "state": "verifying"
  },
  {
    "jobId": "7919c9cd-layout-check",
    "seq": 54,